[
  {
    "id": "P-101",
    "title": "Input focus zooms the whole page",
    "section": "ios-webkit",
    "severity": "P1",
    "detect": [
      "runtime"
    ],
    "confidence": "advisory",
    "deviceOnly": true,
    "aiWrites": "`<input class=\"text-sm\">` / `font-size: 14px` on form controls.",
    "symptom": "iOS Safari auto-zooms any focused control whose computed font-size < 16px, then never zooms back. The app instantly reads as a website.",
    "correct": "Computed font-size >= 16px on every input, select, textarea. If the design needs smaller text, shrink with padding/line-height, not font-size. Do not fix this by disabling zoom (see P-701).",
    "detectNotes": "Reclassified: computed font-size cannot be read from source alone (Tailwind/CSS cascade + inheritance resolve it at render time). Phase 2 will implement this as a computed-style/DOM sweep: focus each control, assert visualViewport.scale === 1, and read computed font-size directly. [D] real iOS confirm.",
    "rule": null,
    "probe": null,
    "verified": {
      "ios": "18.x",
      "chrome": "13x",
      "date": "2026-07-30"
    }
  },
  {
    "id": "P-102",
    "title": "`100vh` is wrong on mobile",
    "section": "ios-webkit",
    "severity": "P1",
    "detect": [
      "static",
      "runtime"
    ],
    "confidence": "advisory",
    "deviceOnly": false,
    "aiWrites": "`h-screen`, `min-h-screen`, `height: 100vh`.",
    "symptom": "iOS `vh` is sized to the expanded viewport, ignoring the URL bar. Bottom content and fixed CTAs sit below the fold; a full-height layout scrolls when it shouldn't.",
    "correct": "`100dvh` with a `100vh` fallback for old engines; or the `--vh` JS custom-property pattern where `dvh` isn't viable. Know the family: `svh` (smallest/URL-bar-visible), `lvh` (largest), `dvh` (dynamic).",
    "detectNotes": "[S] flag `100vh` / `h-screen` in any layout-critical rule. [R] assert no vertical overflow with the URL bar simulated. Advisory: `h-screen` is legitimate inside a fixed shell — flag, don't fail.",
    "rule": null,
    "probe": null,
    "verified": {
      "ios": "18.x",
      "chrome": "13x",
      "date": "2026-07-30"
    }
  },
  {
    "id": "P-103",
    "title": "Safe-area insets ignored (notch + home indicator)",
    "section": "ios-webkit",
    "severity": "P0",
    "detect": [
      "static",
      "runtime",
      "visual"
    ],
    "confidence": "advisory",
    "deviceOnly": false,
    "aiWrites": "A fixed bottom tab bar with `padding-bottom: 12px`; no `viewport-fit=cover`.",
    "symptom": "The tab bar sits under the home indicator and is partly untappable; the header hides behind the notch/Dynamic Island.",
    "correct": "`<meta name=\"viewport\" content=\"... viewport-fit=cover\">` and `padding-bottom: calc(12px + env(safe-area-inset-bottom))` on the bottom bar, `env(safe-area-inset-top)` on the header, plus `-left`/`-right` in landscape.",
    "detectNotes": "[S] `viewport-fit=cover` present AND every `position: fixed` edge-anchored element references the matching `env(safe-area-inset-*)`. [V] snapshot on a notched device profile. Advisory: matching an element's anchored edge to the right inset is a bundled heuristic, not a single crisp match.",
    "rule": null,
    "probe": null,
    "verified": {
      "ios": "18.x",
      "chrome": "13x",
      "date": "2026-07-30"
    }
  },
  {
    "id": "P-104",
    "title": "Fixed bottom bar breaks when the keyboard opens",
    "section": "ios-webkit",
    "severity": "P1",
    "detect": [
      "runtime"
    ],
    "confidence": "advisory",
    "deviceOnly": true,
    "aiWrites": "`position: fixed; bottom: 0` for the composer / CTA.",
    "symptom": "iOS does not resize the layout viewport for the virtual keyboard. The bar stays pinned to the old bottom — floating behind or over the keyboard.",
    "correct": "Drive the offset from the VisualViewport API (`visualViewport.height`, `offsetTop`, `resize` + `scroll` events), or use `interactive-widget=resizes-content` in the viewport meta where supported.",
    "detectNotes": "[R] simulate keyboard, assert bar's bounding box stays above the visual viewport bottom. [D] real device is authoritative.",
    "rule": null,
    "probe": null,
    "verified": {
      "ios": "18.x",
      "chrome": "13x",
      "date": "2026-07-30"
    }
  },
  {
    "id": "P-105",
    "title": "Rubber-band overscroll reveals the page background",
    "section": "ios-webkit",
    "severity": "P1",
    "detect": [
      "static"
    ],
    "confidence": "high",
    "deviceOnly": false,
    "aiWrites": null,
    "symptom": "Dragging past the top/bottom shows the browser/body background behind your \"app\" — the single biggest tell that it's a web page.",
    "correct": "`overscroll-behavior: none` on the scroll root; give `html, body` the app background; for a true app shell use the fixed-body pattern with a single internal scroller.",
    "detectNotes": "[S] assert `overscroll-behavior` set on the scroll container.",
    "rule": null,
    "probe": null,
    "verified": {
      "ios": "18.x",
      "chrome": "13x",
      "date": "2026-07-30"
    }
  },
  {
    "id": "P-106",
    "title": "Browser pull-to-refresh fights in-app pull-to-refresh",
    "section": "ios-webkit",
    "severity": "P1",
    "detect": [
      "static",
      "runtime"
    ],
    "confidence": "high",
    "deviceOnly": false,
    "aiWrites": null,
    "symptom": "The browser's native pull-to-refresh gesture fires alongside the app's own in-app pull-to-refresh, so pulling down triggers a full page reload instead of (or on top of) the in-app refresh.",
    "correct": "`overscroll-behavior-y: contain` on the scroller.",
    "detectNotes": "[S] scanner. [R] assert a top overscroll gesture does not trigger navigation reload.",
    "rule": null,
    "probe": null,
    "verified": {
      "ios": "18.x",
      "chrome": "13x",
      "date": "2026-07-30"
    }
  },
  {
    "id": "P-107",
    "title": "`100vw` causes horizontal scroll",
    "section": "ios-webkit",
    "severity": "P1",
    "detect": [
      "static",
      "runtime"
    ],
    "confidence": "high",
    "deviceOnly": false,
    "aiWrites": "`w-screen` / `width: 100vw`.",
    "symptom": "`100vw` includes the scrollbar gutter, causing a few px of horizontal scroll, which on mobile becomes a visible sideways drag of the whole app.",
    "correct": "`width: 100%` / `100dvw`, or `max-width: 100%`.",
    "detectNotes": "[S] flag `100vw`. [R] assert `document.scrollingElement.scrollWidth <= clientWidth` at 320/360/390/430px.",
    "rule": null,
    "probe": null,
    "verified": {
      "ios": "18.x",
      "chrome": "13x",
      "date": "2026-07-30"
    }
  },
  {
    "id": "P-108",
    "title": "Grey tap flash on every touch",
    "section": "ios-webkit",
    "severity": "P2",
    "detect": [
      "static"
    ],
    "confidence": "high",
    "deviceOnly": false,
    "aiWrites": null,
    "symptom": "Every touch on an interactive element shows Safari's default grey tap-highlight flash, which reads as unpolished/web-like — and removing it without a real `:active` state removes touch feedback entirely.",
    "correct": "`-webkit-tap-highlight-color: transparent` on interactive elements, paired with a real `:active` state so feedback isn't lost.",
    "detectNotes": "[S] scanner; also assert a visible `:active` style exists (removing the flash without replacing it is its own P2).",
    "rule": null,
    "probe": null,
    "verified": {
      "ios": "18.x",
      "chrome": "13x",
      "date": "2026-07-30"
    }
  },
  {
    "id": "P-109",
    "title": "`:hover` styles latch on touch",
    "section": "ios-webkit",
    "severity": "P1",
    "detect": [
      "static"
    ],
    "confidence": "advisory",
    "deviceOnly": false,
    "aiWrites": "`hover:bg-slate-100` everywhere.",
    "symptom": "On touch, hover state applies on tap and stays until you tap elsewhere — buttons look permanently selected.",
    "correct": "Wrap hover-dependent styles in `@media (hover: hover) and (pointer: fine)`.",
    "detectNotes": "[S] flag hover rules that carry visual state and aren't hover-media-gated. Advisory: must detect Tailwind's `hoverOnlyWhenSupported` config before flagging, or every hover rule false-positives.",
    "rule": null,
    "probe": null,
    "verified": {
      "ios": "18.x",
      "chrome": "13x",
      "date": "2026-07-30"
    }
  },
  {
    "id": "P-110",
    "title": "Double-tap zoom + legacy tap delay",
    "section": "ios-webkit",
    "severity": "P1",
    "detect": [
      "static"
    ],
    "confidence": "high",
    "deviceOnly": false,
    "aiWrites": null,
    "symptom": "Interactive elements lack `touch-action: manipulation`, so taps can trigger the browser's double-tap-to-zoom gesture. Historically this class of fix was framed around a ~300ms tap delay, but that delay is already gone in modern browsers given a correct viewport meta — the property's real remaining value today is suppressing double-tap zoom.",
    "correct": "Add `touch-action: manipulation` to interactive elements to suppress double-tap zoom. The 300ms delay itself is no longer an issue in modern browsers with a correct viewport meta; don't cite delay-removal as the justification.",
    "detectNotes": "[S] scanner on buttons/links/tappables.",
    "rule": null,
    "probe": null,
    "verified": {
      "ios": "18.x",
      "chrome": "13x",
      "date": "2026-07-30"
    }
  },
  {
    "id": "P-111",
    "title": "Long-press selects UI text",
    "section": "ios-webkit",
    "severity": "P1",
    "detect": [
      "runtime"
    ],
    "confidence": "advisory",
    "deviceOnly": false,
    "aiWrites": "Nothing — or, worse, `user-select: none` on `*`.",
    "symptom": "Long-pressing a tab label or button selects it and pops the iOS selection bubbles. Feels like a webpage.",